<?xml version="1.0" encoding="UTF-8"?>
<tns:keyspace xmlns:tns="http://cassamdrabm.bsc.es/CassandraModel" 
              xmlns:xsi="http://www.w3.org/2001/XMLSchema-instance" 
              xmlns:cmt="http://cassamdrabm.bsc.es/CommonTypes"
              xsi:schemaLocation="http://cassamdrabm.bsc.es/CassandraModel ../../../../model/src/main/resources/CassandraModel.xsd"
              name="workspace">            
    <tns:strategy>SimpleStrategy</tns:strategy>    
    <tns:replicationFactor>1</tns:replicationFactor>
    
   
    <tns:columnFamily name="workspace">     
        <tns:column id="desc">
            <tns:refPath > <!-- This indicates to use the value as column name -->
                <tns:level value="workspace" >
                    <tns:keyDest position=""/>
                </tns:level>
                <tns:level value="desc"  >
                    <tns:columnDest position="0"/> 
                </tns:level>
            </tns:refPath>              
        </tns:column>
        <tns:column id="creationTime">
            <tns:refPath > <!-- This indicates to use the value as column name -->
                <tns:level value="workspace" >
                    <tns:keyDest position=""/>
                </tns:level>
                <tns:level value="creationTime"  >
                    <tns:columnDest position="0"/> 
                </tns:level>
            </tns:refPath>              
        </tns:column>
        <tns:column id="modificationTime">
            <tns:refPath > <!-- This indicates to use the value as column name -->
                <tns:level value="workspace" >
                    <tns:keyDest position=""/>
                </tns:level>
                <tns:level value="modificationTime"  >
                    <tns:columnDest position="0"/> 
                </tns:level>
            </tns:refPath>              
        </tns:column>
    </tns:columnFamily>
    <tns:columnFamily name="sets">
        <tns:column id="sets">
            <tns:refPath > <!-- This indicates to use the value as column name -->
                <tns:level value="workspace" >
                    <tns:keyDest position="0"/>
                </tns:level>
                <tns:level value="sets"/>                    
                <tns:level value="sname"  >
                    <tns:columnDest position="0"/> 
                </tns:level>
            </tns:refPath> 
        </tns:column>        
    </tns:columnFamily>
    <tns:columnFamily name="snippets">
        <tns:column id="data">
            <tns:refPath > <!-- This indicates to use the value as column name -->
                <tns:level value="workspace" >
                    <tns:keyDest position="0"/>
                </tns:level>
                <tns:level value="sname">
                    <tns:keyDest position="1"/>
                </tns:level>                    
                <tns:level value="data" >                    
                </tns:level>
                <tns:level value="time" >
                    <tns:columnDest position="0"/> 
                </tns:level>        
            </tns:refPath> 
        </tns:column>        
          
    </tns:columnFamily>
    <tns:columnFamily name="tags">
        <tns:column id="tags">
            <tns:refPath > <!-- This indicates to use the value as column name -->
                <tns:level value="workspace" >
                    <tns:keyDest position="0"/>
                </tns:level>
                <tns:level value="snippets" />              
                <tns:level value="sname">
                    <tns:keyDest position="1"/>
                </tns:level>                    
                <tns:level value="tag" > 
                    <tns:keyDest position="0">                   
                </tns:level>
  
            </tns:refPath> 
        </tns:column>        
    </tns:columnFamily>
</tns:keyspace>
