<?xml version="1.0" encoding="UTF-8"?>
<tns:keyspace xmlns:tns="http://cassamdrabm.bsc.es/CassandraModel" 
              xmlns:xsi="http://www.w3.org/2001/XMLSchema-instance" 
              xmlns:cmt="http://cassamdrabm.bsc.es/CommonTypes"
              xsi:schemaLocation="http://cassamdrabm.bsc.es/CassandraModel ../src/main/resources/CassandraModel.xsd"
              name="DOP2LevelPerfect">            
    <tns:strategy>SimpleStrategy</tns:strategy>
    <tns:replicationFactor>1</tns:replicationFactor>

    <tns:columnFamily name="framemeta">
        <tns:keyCacheSize>200.0</tns:keyCacheSize>
        <tns:keyCachePeriod>60</tns:keyCachePeriod>
        <tns:rowCacheSize>100</tns:rowCacheSize>
        <tns:rowCachePeriod>120</tns:rowCachePeriod>
        <tns:fixedRow>
            <tns:key type="Int32Type">-1</tns:key>
            <tns:column>
          
                <tns:fixedColumnName name="natoms">
                    <cmt:standardType>UTF8Type</cmt:standardType>
                </tns:fixedColumnName>
               
                <tns:refPath>
                    <tns:level value="frame">
                        <tns:keyDest position="0"/>
                    </tns:level>
                    <tns:level value="natoms"/>
                    
                </tns:refPath>
            </tns:column>
            <tns:column>
         
                <tns:fixedColumnName name="prec">
                    <cmt:standardType>UTF8Type</cmt:standardType>
                </tns:fixedColumnName>
                
                <tns:refPath>
                    <tns:level value="frame">
                        <tns:keyDest position="0"/>
                    </tns:level>
                    <tns:level value="prec"/>
                </tns:refPath> 		
            </tns:column>
        </tns:fixedRow>
        <tns:column>
            <tns:fixedColumnName name="step">
                <cmt:standardType>UTF8Type</cmt:standardType>
            </tns:fixedColumnName>
            <tns:refPath>
                <tns:level value="frame">
                    <tns:keyDest position="0"/>
                </tns:level>
                <tns:level value="step"/>
            </tns:refPath>
        </tns:column>
        <tns:column>
            <tns:fixedColumnName name="box">
                <cmt:standardType>UTF8Type</cmt:standardType>
            </tns:fixedColumnName>
            <tns:refPath>
                <tns:level value="frame">
                    <tns:keyDest position="0"/>
                </tns:level>
                <tns:level value="box"/>
            </tns:refPath>
        </tns:column>       
    </tns:columnFamily>
    <tns:columnFamily name="time">
        <tns:keyCacheSize>200.0</tns:keyCacheSize>
        <tns:keyCachePeriod>60</tns:keyCachePeriod>
        <tns:rowCacheSize>100</tns:rowCacheSize>
        <tns:rowCachePeriod>120</tns:rowCachePeriod>
        <tns:fixedRow>
            <tns:key type="Int32Type">-2</tns:key>
            <tns:column>
                <tns:refPath>
                    <tns:level value="frame">
                        <tns:valueDest position="0"/>
                    </tns:level>
                    <tns:level value="time" />
                    <tns:columnDest position="0"/>
                </tns:refPath>                  
            </tns:column>
        </tns:fixedRow>
        
    </tns:columnFamily>
    <tns:columnFamily name="pointsindex">
        <tns:column>
            <tns:refPath > <!-- This indicates to use the value as column name -->
                <tns:level value="frame">
                    <tns:columnDest position="1"/>
                </tns:level>
                <tns:level value="points"/>
                <tns:level value="index">
                    <tns:columnDest position="2"/>
                </tns:level>  
                <tns:keyDest position="0" attr="getX"/>
                <tns:columnDest position="0" attr="getY"/>
            </tns:refPath>
            <tns:valueless></tns:valueless>
        </tns:column>
        
    </tns:columnFamily>
    <tns:columnFamily name="points">
        <tns:column>
            <tns:refPath > <!-- This indicates to use the value as column name -->
                <tns:level value="frame">
                    <tns:keyDest position="0"/>
                </tns:level>
                <tns:level value="points"/>
                <tns:level value="index">
                    <tns:keyDest position="1"/>
                </tns:level>  
                <tns:columnDest position="0" attr="getZ"/>
                <tns:valueDest position="0"/>
            </tns:refPath>
          
        </tns:column>
        
    </tns:columnFamily>
</tns:keyspace>
