<?xml version="1.0" encoding="UTF-8"?>
<tns:keyspace xmlns:tns="http://cassamdrabm.bsc.es/CassandraModel" 
              xmlns:xsi="http://www.w3.org/2001/XMLSchema-instance" 
              xmlns:cmt="http://cassamdrabm.bsc.es/CommonTypes"
              xsi:schemaLocation="http://cassamdrabm.bsc.es/CassandraModel ../../../../model/src/main/resources/CassandraModel.xsd"
              name="testspace">            
    <tns:strategy>SimpleStrategy</tns:strategy>
    <tns:replicationFactor>1</tns:replicationFactor>

    <tns:columnFamily name="frame">
        <tns:keyCacheSize>200.0</tns:keyCacheSize>
        <tns:keyCachePeriod>60</tns:keyCachePeriod>
        <tns:rowCacheSize>100</tns:rowCacheSize>
        <tns:rowCachePeriod>120</tns:rowCachePeriod>
        <tns:fixedRow>
            <tns:key type="Int32Type">-1</tns:key>
            <tns:column name="natoms">
                <tns:fixedColumnName name="natoms">
                    <cmt:standardType>UTF8Type</cmt:standardType>
                </tns:fixedColumnName>
                <tns:refPath>
                    <tns:level value="frame"/>
                    <tns:level value="natoms"/>
                    
                </tns:refPath>
            </tns:column>
            <tns:column  index="true" name="prec">
                <tns:fixedColumnName name="prec">
                    <cmt:standardType>UTF8Type</cmt:standardType>
                </tns:fixedColumnName>
                <tns:refPath>
                    <tns:level value="frame"/>
                    <tns:level value="prec"/>
                </tns:refPath> 		
            </tns:column>
        </tns:fixedRow>
         <tns:column name="FxA" >
            <tns:refPath>
                <tns:level value="frame">
                    <tns:keyDest position="0"/>
                </tns:level> 
                <tns:level value="points"/>
                <tns:level value="index">
                    <tns:columnDest position="0"/>
                </tns:level>  
            </tns:refPath>
        </tns:column>
        <tns:column name="step">
            <tns:fixedColumnName name="step">
                <cmt:standardType>UTF8Type</cmt:standardType>
            </tns:fixedColumnName>
            <tns:refPath>
                <tns:level value="frame">
                    <tns:keyDest position="0"/>
                </tns:level>
                <tns:level value="step"/>
            </tns:refPath>
        </tns:column>
        <tns:column name="box">
            <tns:fixedColumnName name="box">
                <cmt:standardType>UTF8Type</cmt:standardType>
            </tns:fixedColumnName>
            <tns:refPath>
                <tns:level value="frame" >
                    <tns:keyDest position="0"/>
                </tns:level>
                <tns:level value="box"/>
            </tns:refPath>
        </tns:column>
    </tns:columnFamily>
    <tns:columnFamily name="time">
        <tns:keyCacheSize>50.0</tns:keyCacheSize>
        <tns:keyCachePeriod>30</tns:keyCachePeriod>
        <tns:rowCacheSize>0.75</tns:rowCacheSize>
        <tns:rowCachePeriod>45</tns:rowCachePeriod>
        <tns:column name="time">
            <tns:refPath >
                <tns:level value="frame">
                    <tns:columnDest position="0"/>
                </tns:level> 
                <tns:level value="time" />
                <tns:keyDest position="0"/>
            </tns:refPath>  
            <tns:valueless></tns:valueless>
        </tns:column>
    </tns:columnFamily>
</tns:keyspace>
