<?xml version="1.0" encoding="UTF-8"?>
<tns:keyspace xmlns:tns="http://cassamdrabm.bsc.es/CassandraModel" 
              xmlns:xsi="http://www.w3.org/2001/XMLSchema-instance" 
              xmlns:cmt="http://cassamdrabm.bsc.es/CommonTypes"
              xsi:schemaLocation="http://cassamdrabm.bsc.es/CassandraModel ../../../../model/src/main/resources/CassandraModel.xsd"
              name="metricspace">            
    <tns:strategy>SimpleStrategy</tns:strategy>    
    <tns:replicationFactor>1</tns:replicationFactor>
    <tns:columnFamily name="lists">
        <tns:fixedRow>
             <tns:key  type="UTF8Type">tests-list</tns:key>
             <tns:column name="test-list">     
                <tns:refPath > <!-- This indicates to use the value as column name -->
                    <tns:level value="context"/>
                    <tns:level value="testname"  >
                          <tns:columnDest position="0"/> 
                    </tns:level>
                    <tns:level value="location" />
                    <tns:level value="start"/>  
                </tns:refPath>  
                <tns:valueless/>
            </tns:column>
        </tns:fixedRow>       
        <tns:fixedRow>
             <tns:key  type="UTF8Type">nodes-list</tns:key>
             <tns:column name="nodes-list">     
                <tns:refPath > <!-- This indicates to use the value as column name -->
                    <tns:level value="context" >
                           <tns:columnDest position="0"/> 
                    </tns:level>                   
                    <tns:level value="testname" />
                    <tns:level value="location" >
                          <tns:columnDest position="1"/> 
                    </tns:level>
                    <tns:level value="start"/>  
                </tns:refPath>  
                <tns:valueless/>
            </tns:column>
        </tns:fixedRow> 
         <tns:fixedRow>
             <tns:key  type="UTF8Type">context-list</tns:key>
             <tns:column name="context-list">     
                <tns:refPath > <!-- This indicates to use the value as column name -->
                    <tns:level value="context" >
                           <tns:columnDest position="0"/> 
                    </tns:level>                   
                    <tns:level value="testname" />
                    <tns:level value="location" >
                          <tns:columnDest position="1"/> 
                    </tns:level>
                    <tns:level value="start"/>  
                </tns:refPath>  
                <tns:valueless/>
            </tns:column>
        </tns:fixedRow> 
    </tns:columnFamily>     
    <tns:columnFamily name="tests">       
        
              <tns:column name="start">     
            <tns:fixedColumnName name="start" position="2">
                <cmt:standardType>UTF8Type</cmt:standardType>
            </tns:fixedColumnName>     
            <tns:refPath > <!-- This indicates to use the value as column name -->
                <tns:level value="context">
                      <tns:keyDest position="0"/>   
                </tns:level>
                <tns:level value="testname" >    
                  <tns:columnDest position="0"/>      
              </tns:level>
              <tns:level value="location" >
               <tns:columnDest position="1"/>      
              </tns:level>                 
                <tns:level value="start"/>  
                <tns:valueDest position="0"/>           
            </tns:refPath>  
        </tns:column>
         <tns:column name="stop">     
            <tns:fixedColumnName name="stop" position="2">
                <cmt:standardType>UTF8Type</cmt:standardType>
            </tns:fixedColumnName>     
           <tns:refPath > <!-- This indicates to use the value as column name -->
                  <tns:level value="context">
                      <tns:keyDest position="0"/>   
                </tns:level>
                <tns:level value="testname" >    
                  <tns:columnDest  position="0"/>      
              </tns:level>             
              <tns:level value="location" > 
                                 <tns:columnDest position="1"/>      
                </tns:level>                
                <tns:level value="stop"/>  
                <tns:valueDest position="0"/>           
            </tns:refPath>    
        </tns:column>
            
    </tns:columnFamily>
    <tns:columnFamily name="metrics">
        <tns:column name="metricsSingle">           
            <tns:refPath > <!-- This indicates to use the value as column name -->
                <tns:level value="context">
                    <tns:keyDest position="0"/>
                    
                </tns:level>
                <tns:level value="testname">
                    <tns:keyDest position="1"/>
                </tns:level>                
                <tns:level value="location">
                     <tns:keyDest position="2"/>
                </tns:level>     
                <tns:level value="time">
                    <tns:columnDest position="1"/>
                </tns:level>             
                <tns:level value="attribute">
                    <tns:columnDest position="0"/>
                </tns:level> 
                
                <tns:valueDest position="0"/>
            </tns:refPath>             
        </tns:column>
<!--        <tns:column name="metricsGroup">           
            <tns:refPath >  This indicates to use the value as column name 
                <tns:level value="context">
                    <tns:keyDest position="0"/>
                    
                </tns:level>
                <tns:level value="testname">
                    <tns:keyDest position="1"/>
                </tns:level>                
                <tns:level value="location">
                    <tns:keyDest position="2"/>
                </tns:level>     
                <tns:level value="time">
                    <tns:columnDest position="0"/>
                </tns:level>     
                <tns:level value="group">
                    <tns:columnDest position="1"/>
                </tns:level>         
                <tns:level value="attribute">
                    <tns:columnDest position="2"/>
                </tns:level> 
                
                <tns:valueDest position="0"/>
            </tns:refPath>             
        </tns:column>-->
    </tns:columnFamily>
</tns:keyspace>
